Category, URL                                                                                                                                                                                                        , Brand                     , Product Name                                                                                    , Ingredients
cleanser, https://www.sephora.com/product/mini-cream-skin-refillable-toner-moisturizer-with-ceramides-peptides-P505895?skuId=2671873&icid2=products%20grid:p505895:product                                           , LANEIGE                   , Mini Cream Skin Refillable Toner & Moisturizer with Ceramides and Peptides                      , "-Ceramide & Peptide Complex: Nourishes and supports skin’s moisture barrier.-White Leaf Tea Water: Rich in amino acids and soothes and hydrate skin.Water / Aqua / Eau, Butylene Glycol, Glycerin, Limnanthes Alba (Meadowfoam) Seed Oil, Isopentyldiol, 1,2-Hexanediol, Squalane, Polyglyceryl-10 Stearate, Glyceryl Stearate Citrate, Sodium Stearoyl Glutamate, Inulin Lauryl Carbamate, Glyceryl Caprylate, Ethylhexylglycerin, Propanediol, Disodium Edta, Carbomer, Mannitol, Acrylates/Stearyl Methacrylate Copolymer, Tremella Fuciformis Sporocarp Extract, Hyaluronic Acid, Camellia Sinensis Leaf Extract, Xanthan Gum, Ceramide Np, Camellia Japonica Flower Extract, Tocopherol, Acetyl Tetrapeptide-11. -Ceramide & Peptide Complex: Nourishes and supports skin’s moisture barrier.-White Leaf Tea Water: Rich in amino acids and soothes and hydrate skin.Water / Aqua / Eau, Butylene Glycol, Glycerin, Limnanthes Alba (Meadowfoam) Seed Oil, Isopentyldiol, 1,2-Hexanediol, Squalane, Polyglyceryl-10 Stearate, Glyceryl Stearate Citrate, Sodium Stearoyl Glutamate, Inulin Lauryl Carbamate, Glyceryl Caprylate, Ethylhexylglycerin, Propanediol, Disodium Edta, Carbomer, Mannitol, Acrylates/Stearyl Methacrylate Copolymer, Tremella Fuciformis Sporocarp Extract, Hyaluronic Acid, Camellia Sinensis Leaf Extract, Xanthan Gum, Ceramide Np, Camellia Japonica Flower Extract, Tocopherol, Acetyl Tetrapeptide-11."
cleanser, https://www.sephora.com/product/micellar-water-P514831?skuId=2818680&icid2=products%20grid:p514831:product                                                                                                 , SEPHORA COLLECTION        , Micellar Cleansing Water With Postbiotics + Niacinamide                                         , "-Postbiotics: Helps support and nourish the skin barrier.-Niacinamide: Helps promote hydrated, smooth and even-toned skin.Aqua (Water), Pentylene Glycol, Niacinamide, Poloxamer 184, Caprylyl/Capryl Glucoside, Glycerin, PEG-6 Caprylic/Capric Glycerides, Lactococcus Ferment Lysate, Potassium Sorbate, Carbomer, Parfum (Fragrance), Citric Acid, Sodium Hydroxide, Lactic Acid, Sodium Chloride, Phenylpropanol, Levulinic Acid, Sodium Levulinate. -Postbiotics: Helps support and nourish the skin barrier.-Niacinamide: Helps promote hydrated, smooth and even-toned skin.Aqua (Water), Pentylene Glycol, Niacinamide, Poloxamer 184, Caprylyl/Capryl Glucoside, Glycerin, PEG-6 Caprylic/Capric Glycerides, Lactococcus Ferment Lysate, Potassium Sorbate, Carbomer, Parfum (Fragrance), Citric Acid, Sodium Hydroxide, Lactic Acid, Sodium Chloride, Phenylpropanol, Levulinic Acid, Sodium Levulinate."
cleanser, https://www.sephora.com/product/glossier-milky-oil-P504919?skuId=2636744&icid2=products%20grid:p504919:product                                                                                             , Glossier                  , Milky Oil Dual-Phase Waterproof Makeup Remover                                                  , "-Comfrey Root Extract: Soothes dry, stressed skin.-Micellar Water: Attracts dirt, oil, and makeup like a magnet.-Pro-Vitamin B5: A powerful, natural moisturizer.Water/Aqua/Eau, Isohexadecane, PEG-40 Hydrogenated Castor Oil, Panthenol, Glycerin, PPG-26-Buteth-26, Symphytum Officinale Root Extract, Sodium Benzoate, Disodium EDTA, Citric Acid, Sodium Chloride. -Comfrey Root Extract: Soothes dry, stressed skin.-Micellar Water: Attracts dirt, oil, and makeup like a magnet.-Pro-Vitamin B5: A powerful, natural moisturizer.Water/Aqua/Eau, Isohexadecane, PEG-40 Hydrogenated Castor Oil, Panthenol, Glycerin, PPG-26-Buteth-26, Symphytum Officinale Root Extract, Sodium Benzoate, Disodium EDTA, Citric Acid, Sodium Chloride."
cleanser, https://www.sephora.com/product/innisfree-hydrating-green-tea-amino-acid-cleansing-oil-P503942?skuId=2740587&icid2=products%20grid:p503942:product                                                         , innisfree                 , Hydrating Green Tea Amino Acid Cleansing Oil                                                    , "-Green Tea Water: Provides rich hydration and is packed with antioxidants and amino acids.-Amino Acid: Moisturizes, ensuring a gentle, non-stripping cleanse.-Five Botanical Oils: Includes green tea seed oil to dissolve impurities.Cetyl Ethylhexanoate, Isopropyl Palmitate, Sorbeth-30 Tetraoleate, Caprylic/Capric Triglyceride, Decyl Cocoate, C9-12 Alkane, Diisostearyl Malate, Fragrance/Parfum, Coco-Caprylate/Caprate, Prunus Armeniaca (Apricot) Kernel Oil, Simmondsia Chinensis (Jojoba) Seed Oil, Oryza Sativa (Rice) Bran Oil, Camellia Sinensis Seed Oil, Prunus Amygdalus Dulcis (Sweet Almond) Oil, Water/Aqua/Eau, Arginine, Butylene Glycol, Propanediol, 1,2-Hexanediol, Acorus Calamus Root Extract, Ethylhexylglycerin, Sodium Metaphosphate, Camellia Sinensis Leaf Extract.The list of ingredients is subject to change, please consult the packaging of the product purchased. -Green Tea Water: Provides rich hydration and is packed with antioxidants and amino acids.-Amino Acid: Moisturizes, ensuring a gentle, non-stripping cleanse.-Five Botanical Oils: Includes green tea seed oil to dissolve impurities.Cetyl Ethylhexanoate, Isopropyl Palmitate, Sorbeth-30 Tetraoleate, Caprylic/Capric Triglyceride, Decyl Cocoate, C9-12 Alkane, Diisostearyl Malate, Fragrance/Parfum, Coco-Caprylate/Caprate, Prunus Armeniaca (Apricot) Kernel Oil, Simmondsia Chinensis (Jojoba) Seed Oil, Oryza Sativa (Rice) Bran Oil, Camellia Sinensis Seed Oil, Prunus Amygdalus Dulcis (Sweet Almond) Oil, Water/Aqua/Eau, Arginine, Butylene Glycol, Propanediol, 1,2-Hexanediol, Acorus Calamus Root Extract, Ethylhexylglycerin, Sodium Metaphosphate, Camellia Sinensis Leaf Extract.The list of ingredients is subject to change, please consult the packaging of the product purchased."
cleanser, https://www.sephora.com/product/elemis-dynamic-gentle-resurfacing-pads-with-lactic-acid-P510338?skuId=2759066&icid2=products%20grid:p510338:product                                                        , Elemis                    , Dynamic Gentle Resurfacing Pads with Lactic Acid                                                , "-Patented Tri-Enzyme Technology: Effectively breaks up the accumulation of dead skin cells.-Lactic Acid: Gently exfoliating AHA improves the look of skin tone and texture.-Probiotic Ferment Complex: Supports the skin’s renewal process.Aqua/Water/Eau, Butylene Glycol, Lactococcus Ferment Lysate, Polysorbate 20, Methyl Gluceth-20, Lactic Acid, Phenoxyethanol, Betaine, Sodium Hydroxide, Propylene Glycol, Disodium EDTA, Benzoic Acid, Fragrance (Parfum), Dehydroacetic Acid, Ethylhexylglycerin, Papain, Saponins, Sodium Benzoate, Sodium Chloride, Glycerin, Behenyl Alcohol, Butyrospermum Parkii (Shea) Butter, Hydrogenated Castor Oil, Stearyl Alcohol, Poria Cocos Extract, Protease, Saponaria Officinalis Leaf Extract, Subtilisin, Tocopheryl Acetate. -Patented Tri-Enzyme Technology: Effectively breaks up the accumulation of dead skin cells.-Lactic Acid: Gently exfoliating AHA improves the look of skin tone and texture.-Probiotic Ferment Complex: Supports the skin’s renewal process.Aqua/Water/Eau, Butylene Glycol, Lactococcus Ferment Lysate, Polysorbate 20, Methyl Gluceth-20, Lactic Acid, Phenoxyethanol, Betaine, Sodium Hydroxide, Propylene Glycol, Disodium EDTA, Benzoic Acid, Fragrance (Parfum), Dehydroacetic Acid, Ethylhexylglycerin, Papain, Saponins, Sodium Benzoate, Sodium Chloride, Glycerin, Behenyl Alcohol, Butyrospermum Parkii (Shea) Butter, Hydrogenated Castor Oil, Stearyl Alcohol, Poria Cocos Extract, Protease, Saponaria Officinalis Leaf Extract, Subtilisin, Tocopheryl Acetate."
cleanser, https://www.sephora.com/product/tula-skincare-mini-cult-classic-purifying-face-cleanser-P482757?skuId=2500726&icid2=products%20grid:p482757:product                                                        , TULA Skincare             , Mini The Cult Classic Purifying Face Cleanser                                                   , "-Probiotic Extracts: Maintain skin’s balance.-Prebiotics (Chicory Root): Nourish skin.-Turmeric, White Team, and Blueberry: Improve skin texture.Aqua/Water/Eau, Disodium Laureth Sulfosuccinate, Sodium Hydroxypropylsulfonate Laurylglucoside Crosspolymer, Lauryl Glucoside, Sodium Lauryl Sulfoacetate, Sodium Chloride, Disteareth-75 IPDI, Bifida Ferment Lysate, Hydrolyzed Rice Protein, Curcuma Longa (Turmeric) Root Extract, Camellia Sinensis (Green Tea) Leaf Extract, Vaccinium Angustifolium (Blueberry) Fruit Extract, Cichorium Intybus (Chicory) Root Extract, Camelina Sativa Seed Oil, Lactose, Lactis proteinum/Milk Protein/Protéine du lait, Yogurt Powder, Olus Oil/Vegetable Oil/Huile végétale, Tocopheryl Acetate, Ascorbyl Palmitate, Panthenol, Carthamus Tinctorius (Safflower) Seed Oil, Polysorbate 20, Butylene Glycol, Inulin, Pentylene Glycol, Caprylyl Glycol, Coco-Glucoside, Hydroxyethyl Acrylate/Sodium Acryloyldimethyl Taurate Copolymer, Ethylhexylglycerin, PEG-120 Methyl Glucose Dioleate, Styrene/Acrylates Copolymer, Sorbitan Isostearate, Trisodium Ethylenediamine Disuccinate, Glutaral, Glycerin, Citric Acid, Sodium Hydroxide, Sorbic Acid, Phenoxyethanol, Benzoic Acid, Phenethyl Alcohol, Fragrance (Parfum), Alpha-Isomethyl Ionone, Benzyl Benzoate, Citronellol, Hexyl Cinnamal, Limonene, Linalool.The list of ingredients is subject to change, please consult the packaging of the product purchased. -Probiotic Extracts: Maintain skin’s balance.-Prebiotics (Chicory Root): Nourish skin.-Turmeric, White Team, and Blueberry: Improve skin texture.Aqua/Water/Eau, Disodium Laureth Sulfosuccinate, Sodium Hydroxypropylsulfonate Laurylglucoside Crosspolymer, Lauryl Glucoside, Sodium Lauryl Sulfoacetate, Sodium Chloride, Disteareth-75 IPDI, Bifida Ferment Lysate, Hydrolyzed Rice Protein, Curcuma Longa (Turmeric) Root Extract, Camellia Sinensis (Green Tea) Leaf Extract, Vaccinium Angustifolium (Blueberry) Fruit Extract, Cichorium Intybus (Chicory) Root Extract, Camelina Sativa Seed Oil, Lactose, Lactis proteinum/Milk Protein/Protéine du lait, Yogurt Powder, Olus Oil/Vegetable Oil/Huile végétale, Tocopheryl Acetate, Ascorbyl Palmitate, Panthenol, Carthamus Tinctorius (Safflower) Seed Oil, Polysorbate 20, Butylene Glycol, Inulin, Pentylene Glycol, Caprylyl Glycol, Coco-Glucoside, Hydroxyethyl Acrylate/Sodium Acryloyldimethyl Taurate Copolymer, Ethylhexylglycerin, PEG-120 Methyl Glucose Dioleate, Styrene/Acrylates Copolymer, Sorbitan Isostearate, Trisodium Ethylenediamine Disuccinate, Glutaral, Glycerin, Citric Acid, Sodium Hydroxide, Sorbic Acid, Phenoxyethanol, Benzoic Acid, Phenethyl Alcohol, Fragrance (Parfum), Alpha-Isomethyl Ionone, Benzyl Benzoate, Citronellol, Hexyl Cinnamal, Limonene, Linalool.The list of ingredients is subject to change, please consult the packaging of the product purchased."
cleanser, https://www.sephora.com/product/yuja-brightening-toner-pads-with-vitamin-c-niacinamide-P516740?skuId=2876803&icid2=products%20grid:p516740:product                                                         , Hanyul                    , Yuja Brightening Toner Pads with Vitamin C and Niacinamide                                      , "-Yuja C Vegan Vitamin™ (Vitamin C, Vitamin P, and Yuja Peel Oil): Brightens, moisturizes, smooths skin texture, and visibly firms.-Niacinamide (Vitamin B3) 5%: Visibly brightens and evens tone.-Ascorbic Acid and Vitamin C Derivative: Brighten and help fade dark spots.Water/Aqua/Eau, Butylene Glycol, Niacinamide, 1,2-Hexanediol, Propanediol, Polyglyceryl-10 Laurate, Ethylhexylglycerin, 3-O-Ethyl Ascorbic Acid, Adenosine, Gardenia Florida Fruit Extract, Xanthan Gum, Maltodextrin, Limonene, Citric Acid, Polyquaternium-51, Citrus Junos Peel Oil, Dextrin, Sodium Phytate, Glucosyl Hesperidin, Lactobacillus Ferment, Bioflavonoids, Linalool, Ascorbic Acid, Tranexamic Acid, Pinus Strobus Bark Extract, Tocopherol, Citrus Junos Peel Extract, Glutathione. -Yuja C Vegan Vitamin™ (Vitamin C, Vitamin P, and Yuja Peel Oil): Brightens, moisturizes, smooths skin texture, and visibly firms.-Niacinamide (Vitamin B3) 5%: Visibly brightens and evens tone.-Ascorbic Acid and Vitamin C Derivative: Brighten and help fade dark spots.Water/Aqua/Eau, Butylene Glycol, Niacinamide, 1,2-Hexanediol, Propanediol, Polyglyceryl-10 Laurate, Ethylhexylglycerin, 3-O-Ethyl Ascorbic Acid, Adenosine, Gardenia Florida Fruit Extract, Xanthan Gum, Maltodextrin, Limonene, Citric Acid, Polyquaternium-51, Citrus Junos Peel Oil, Dextrin, Sodium Phytate, Glucosyl Hesperidin, Lactobacillus Ferment, Bioflavonoids, Linalool, Ascorbic Acid, Tranexamic Acid, Pinus Strobus Bark Extract, Tocopherol, Citrus Junos Peel Extract, Glutathione."
cleanser, https://www.sephora.com/product/shani-darden-shani-s-starter-set-P505702?skuId=2643278&icid2=products%20grid:p505702:product                                                                               , Shani Darden Skin Care    , It All Starts with Retinol: Shani’s Starter Set                                                 , "-Encapsulated Retinol (Retinol Reform® Treatment Serum): Is a non-irritating form of retinol that improves the look of fine lines and texture.-Lactic Acid 9% (Lactic Acid AHA Exfoliating Serum): Reveals a smoother, brighter, more glowing complexion.-Oat Bran Extract (Cleansing Serum): Nurtures the skin barrier.Cleansing Serum:Aqua (Water, Eau), C14-16 Olefin Sulfonate, PEG-16 Macadamia Glycerides, Caprylyl/Capryl Glucoside, Glycerin, Hydroxypropyl Methylcellulose, Sodium Cocoamphoacetate, Propanediol, Sodium Hyaluronate, Cichorium Intybus (Chicory) Leaf Extract, Avena Sativa (Oat) Kernel Extract, Olea Europaea (Olive) Leaf Extract, Cocamidopropyl Hydrosylsultaine, Sodium Chloride, Xanthan Gum, Phenethyl Alcohol, Phenoxyethanol, Ethylhexylglycerin, Butylene Glycol, Citric Acid, Sodium Hydroxide, Hexylene Glycol, Caprylyl Glycol.Retinol Reform® Treatment Serum:Aqua (Water, Eau), Caprylic/Capric Triglyceride, Glycerin, Pyrus Malus (Apple) Fruit Extract, Lactic Acid, Hydroxyethyl Acrylate/Sodium Acryloyldimethyl Taurate Copolymer, Lactobacillus Ferment, Isohexadecane, Retinol, Copernicia Cerifera Cera (Copernicia Cerifera (Carnauba) Wax, Cire de Carnauba), Glucosamine HCl, Plankton Extract, Camellia Sinensis Leaf Extract, Aloe Barbadensis Leaf Juice, Tocopheryl Acetate, Niacinamide, Hydrogenated Lecithin, Linoleic Acid, Glycine Soja (Soybean) Sterols, Phospholipids, Propanediol, Sodium Cocoamphoacetate, Sorbitan Isostearate, Polysorbate 60, Oryza Sativa (Rice) Bran Extract, Rosmarinus Officinalis (Rosemary) Leaf Extract, Helianthus Annuus (Sunflower) Extract, Tocopherol, Cyamopsis Tetragonoloba, (Guar) Gum, Maltodextrin, Xanthan Gum, Lecithin, Hydrolyzed Algin, Xylitylglucoside, Anhydroxylitol, Xylitol, Tetrasodium Glutamate Diacetate, BHT, BHA, Sodium Hydroxide, Phenoxyethanol, Caprylyl Glycol, Ethylhexylglycerin, Hexylene Glycol.Lactic Acid AHA Exfoliating Serum:Water/Aqua/Eau, Lactic Acid, Glycerin, Butylene Glycol, Caprylic/Capric Triglyceride, Heptyl Undecylenate, Hydroxyethyl Acrylate/Sodium Acryloyldimethyl Taurate Copolymer, Panthenol, Tocopherol, Vaccinium Myrtillus Fruit Extract, Citrus Limon (Lemon) Fruit Extract, Aloe Barbadensis Leaf Juice, Saccharum Officinarum (Sugarcane) Extract, Glyceryl Oleate Citrate, Acer Saccharum (Sugar Maple) Extract, Citrus Aurantium Dulcis (Orange) Fruit Extract, Camellia Sinensis Leaf Extract, Chamomilla Recutita (Matricaria) Flower Extract, Tartaric Acid, Malic Acid, Sodium Hyaluronate, Sodium Acetylated Hyaluronate, Hydrolyzed Sodium Hyaluronate, Sodium Hyaluronate Crosspolymer, Sodium Benzoate, Potassium Sorbate, Pentylene Glycol, Citric Acid, Polysorbate 60, Sorbitan Isostearate, Glycine Soja (Soybean) Oil, Glycolic Acid, Xanthan Gum, Sodium Hydroxide, Caprylyl Glycol, Gluconolactone, Tetrasodium Glutamate Diacetate, Ethylhexylglycerin, Phenoxyethanol. -Encapsulated Retinol (Retinol Reform® Treatment Serum): Is a non-irritating form of retinol that improves the look of fine lines and texture.-Lactic Acid 9% (Lactic Acid AHA Exfoliating Serum): Reveals a smoother, brighter, more glowing complexion.-Oat Bran Extract (Cleansing Serum): Nurtures the skin barrier.Cleansing Serum:Aqua (Water, Eau), C14-16 Olefin Sulfonate, PEG-16 Macadamia Glycerides, Caprylyl/Capryl Glucoside, Glycerin, Hydroxypropyl Methylcellulose, Sodium Cocoamphoacetate, Propanediol, Sodium Hyaluronate, Cichorium Intybus (Chicory) Leaf Extract, Avena Sativa (Oat) Kernel Extract, Olea Europaea (Olive) Leaf Extract, Cocamidopropyl Hydrosylsultaine, Sodium Chloride, Xanthan Gum, Phenethyl Alcohol, Phenoxyethanol, Ethylhexylglycerin, Butylene Glycol, Citric Acid, Sodium Hydroxide, Hexylene Glycol, Caprylyl Glycol.Retinol Reform® Treatment Serum:Aqua (Water, Eau), Caprylic/Capric Triglyceride, Glycerin, Pyrus Malus (Apple) Fruit Extract, Lactic Acid, Hydroxyethyl Acrylate/Sodium Acryloyldimethyl Taurate Copolymer, Lactobacillus Ferment, Isohexadecane, Retinol, Copernicia Cerifera Cera (Copernicia Cerifera (Carnauba) Wax, Cire de Carnauba), Glucosamine HCl, Plankton Extract, Camellia Sinensis Leaf Extract, Aloe Barbadensis Leaf Juice, Tocopheryl Acetate, Niacinamide, Hydrogenated Lecithin, Linoleic Acid, Glycine Soja (Soybean) Sterols, Phospholipids, Propanediol, Sodium Cocoamphoacetate, Sorbitan Isostearate, Polysorbate 60, Oryza Sativa (Rice) Bran Extract, Rosmarinus Officinalis (Rosemary) Leaf Extract, Helianthus Annuus (Sunflower) Extract, Tocopherol, Cyamopsis Tetragonoloba, (Guar) Gum, Maltodextrin, Xanthan Gum, Lecithin, Hydrolyzed Algin, Xylitylglucoside, Anhydroxylitol, Xylitol, Tetrasodium Glutamate Diacetate, BHT, BHA, Sodium Hydroxide, Phenoxyethanol, Caprylyl Glycol, Ethylhexylglycerin, Hexylene Glycol.Lactic Acid AHA Exfoliating Serum:Water/Aqua/Eau, Lactic Acid, Glycerin, Butylene Glycol, Caprylic/Capric Triglyceride, Heptyl Undecylenate, Hydroxyethyl Acrylate/Sodium Acryloyldimethyl Taurate Copolymer, Panthenol, Tocopherol, Vaccinium Myrtillus Fruit Extract, Citrus Limon (Lemon) Fruit Extract, Aloe Barbadensis Leaf Juice, Saccharum Officinarum (Sugarcane) Extract, Glyceryl Oleate Citrate, Acer Saccharum (Sugar Maple) Extract, Citrus Aurantium Dulcis (Orange) Fruit Extract, Camellia Sinensis Leaf Extract, Chamomilla Recutita (Matricaria) Flower Extract, Tartaric Acid, Malic Acid, Sodium Hyaluronate, Sodium Acetylated Hyaluronate, Hydrolyzed Sodium Hyaluronate, Sodium Hyaluronate Crosspolymer, Sodium Benzoate, Potassium Sorbate, Pentylene Glycol, Citric Acid, Polysorbate 60, Sorbitan Isostearate, Glycine Soja (Soybean) Oil, Glycolic Acid, Xanthan Gum, Sodium Hydroxide, Caprylyl Glycol, Gluconolactone, Tetrasodium Glutamate Diacetate, Ethylhexylglycerin, Phenoxyethanol."
cleanser, https://www.sephora.com/product/peace-out-pore-perfecting-stick-P507210?skuId=2701068&icid2=products%20grid:p507210:product                                                                                , Peace Out                 , AHA Pore & Blackhead Exfoliator Multitasking Treatment Stick                                    , "-Kaolin Clay: Targets oil and impurities to reduce the look of clogged pores.-5 Acid Blend: Exfoliates dead skin cells to improve the look of tone and texture.-Mushroom Extract: Minimizes the look of pores and smooths texture.Water/Aqua/Eau, Propanediol, Sodium Stearate, Hydrated Silica, Kaolin, Glycerin, Lactic Acid, Phenoxyethanol, Sodium Hydroxide, Xanthan Gum, Niacinamide, Algin, Mandelic Acid, Fomes Officinalis (Mushroom) Extract, Farnesol, Ethylhexylglycerin, Glycolic Acid, Galactoarabinan, Mangifera Indica (Mango) Fruit Extract, Carica Papaya (Papaya) Fruit Extract, Ananas Sativus (Pineapple) Fruit Extract, Salicylic Acid, Adipic Acid, Sodium Carbonate, Polylysine.The list of ingredients is subject to change, please consult the packaging of the product purchased. -Kaolin Clay: Targets oil and impurities to reduce the look of clogged pores.-5 Acid Blend: Exfoliates dead skin cells to improve the look of tone and texture.-Mushroom Extract: Minimizes the look of pores and smooths texture.Water/Aqua/Eau, Propanediol, Sodium Stearate, Hydrated Silica, Kaolin, Glycerin, Lactic Acid, Phenoxyethanol, Sodium Hydroxide, Xanthan Gum, Niacinamide, Algin, Mandelic Acid, Fomes Officinalis (Mushroom) Extract, Farnesol, Ethylhexylglycerin, Glycolic Acid, Galactoarabinan, Mangifera Indica (Mango) Fruit Extract, Carica Papaya (Papaya) Fruit Extract, Ananas Sativus (Pineapple) Fruit Extract, Salicylic Acid, Adipic Acid, Sodium Carbonate, Polylysine.The list of ingredients is subject to change, please consult the packaging of the product purchased."
cleanser, https://www.sephora.com/product/take-the-day-off-makeup-remover-for-lids-lashes-lips-P122735?skuId=48074&icid2=products%20grid:p122735:product                                                             , CLINIQUE                  , "Take The Day Off Makeup Remover For Lids, Lashes & Lips"                                       , "Water, Isohexadecane, Dimethicone, Cyclopentasiloxane, Trisiloxane, Peg-4 Dilaurate, Lauryl Methyl Gluceth-10 Hydroxypropyldimonium Chloride, Hexylene Glycol, Sodium Chloride, Potassium Phosphate, Dipotassium Phosphate, Dipotassium Edta, Phenoxyethanol.Please be aware that ingredient lists may change or vary from time to time. Please refer to the ingredient list on the product package you receive for the most up to date list of ingredients. Water, Isohexadecane, Dimethicone, Cyclopentasiloxane, Trisiloxane, Peg-4 Dilaurate, Lauryl Methyl Gluceth-10 Hydroxypropyldimonium Chloride, Hexylene Glycol, Sodium Chloride, Potassium Phosphate, Dipotassium Phosphate, Dipotassium Edta, Phenoxyethanol.Please be aware that ingredient lists may change or vary from time to time. Please refer to the ingredient list on the product package you receive for the most up to date list of ingredients."
cleanser, https://www.sephora.com/product/facial-treatment-essence-P375849?skuId=1448612&icid2=products%20grid:p375849:product                                                                                       , SK-II                     , Aging Skin Facial Treatment Essence with Antioxidants                                           , "-PITERA™: SK-II's signature ingredient that supports skin's natural regeneration.Galactomyces Ferment Filtrate (PITERA™), Butylene Glycol, Pentylene Glycol, Water, Sodium Benzoate, Methylparaben, Sorbic Acid. -PITERA™: SK-II's signature ingredient that supports skin's natural regeneration.Galactomyces Ferment Filtrate (PITERA™), Butylene Glycol, Pentylene Glycol, Water, Sodium Benzoate, Methylparaben, Sorbic Acid."
cleanser, https://www.sephora.com/product/peter-thomas-roth-even-smoother-tm-microdermabrasion-exfoliating-pore-purifier-P512593?skuId=2779759&icid2=products%20grid:p512593:product                                 , Peter Thomas Roth         , Even Smoother™ Microdermabrasion Exfoliating Pore Purifier                                      , "-2% Salicylic Acid: Helps cleanse and nourish the look of pores.-5% Microencapsulated Enzymatic Complex: Visibly removes surface impurities and excess oil that can clog pores.-Smoothing Crystals: Polish skin's surface to whisk away pore-clogging debris.Water/Aqua/Eau, Alumina, Propanediol, Bentonite, Kaolin, Glycerin, Maltodextrin, Aloe Barbadensis Leaf Juice, Cellulose, Salicylic Acid, Titanium Dioxide (CI 77891), Protease, Sodium Hyaluronate, Sodium Hydroxide, Citric Acid, Potassium Sorbate, Sodium Benzoate, Polyacrylate Crosspolymer-6, Polysorbate 20, Ethylhexylglycerin, Phenoxyethanol.The list of ingredients is subject to change, please consult the packaging of the product purchased. -2% Salicylic Acid: Helps cleanse and nourish the look of pores.-5% Microencapsulated Enzymatic Complex: Visibly removes surface impurities and excess oil that can clog pores.-Smoothing Crystals: Polish skin's surface to whisk away pore-clogging debris.Water/Aqua/Eau, Alumina, Propanediol, Bentonite, Kaolin, Glycerin, Maltodextrin, Aloe Barbadensis Leaf Juice, Cellulose, Salicylic Acid, Titanium Dioxide (CI 77891), Protease, Sodium Hyaluronate, Sodium Hydroxide, Citric Acid, Potassium Sorbate, Sodium Benzoate, Polyacrylate Crosspolymer-6, Polysorbate 20, Ethylhexylglycerin, Phenoxyethanol.The list of ingredients is subject to change, please consult the packaging of the product purchased."
