Category, URL                                                                                                                                                                                                        , Brand                     , Product Name                                                                                    , Ingredients
cleanser, https://www.sephora.com/product/dam-dam-nomad-s-cream-purifying-exfoliating-cleanser-P472023?skuId=2463073&icid2=products%20grid:p472023:product                                                           , DAMDAM                    , Nomad’s Cream Purifying & Exfoliating AHA Cleanser                                              , "-Konnyaku: A vitamin-rich Japanese tuber plant that purifies pores and tightens the look of skin.-Phytic Acid: A gently exfoliating AHA in Japanese rice that improves the look of tone and pore size.-Tea Tree Oil: A powerful antibacterial that targets breakouts and soothes irritation.Water, Dicaprylyl Ether,Caprylic/Capric Triglyceride, Propanediol, Helianthus Annuus (Sunflower) Seed Oil, Behenyl Alcohol, Pentylene Glycol, Glycerin, Polyglyceryl-2 Stearate, Glyceryl Stearate, Stearyl Alcohol, Mannan, Sodium Citrate, Citrus Aurantium Dulcis (Orange) Peel Oil, Phytic Acid, Glycyrrhiza Glabra (Licorice) Root Extract, Cananga Odorata Flower Oil, Cocos Nucifera (Coconut) Oil, Melaleuca Alternifolia (Tea Tree) Leaf Oil, Salix Alba (Willow) Bark Extract, Tocopherol.The list of ingredients is subject to change, please consult the packaging of the product purchased. -Konnyaku: A vitamin-rich Japanese tuber plant that purifies pores and tightens the look of skin.-Phytic Acid: A gently exfoliating AHA in Japanese rice that improves the look of tone and pore size.-Tea Tree Oil: A powerful antibacterial that targets breakouts and soothes irritation.Water, Dicaprylyl Ether,Caprylic/Capric Triglyceride, Propanediol, Helianthus Annuus (Sunflower) Seed Oil, Behenyl Alcohol, Pentylene Glycol, Glycerin, Polyglyceryl-2 Stearate, Glyceryl Stearate, Stearyl Alcohol, Mannan, Sodium Citrate, Citrus Aurantium Dulcis (Orange) Peel Oil, Phytic Acid, Glycyrrhiza Glabra (Licorice) Root Extract, Cananga Odorata Flower Oil, Cocos Nucifera (Coconut) Oil, Melaleuca Alternifolia (Tea Tree) Leaf Oil, Salix Alba (Willow) Bark Extract, Tocopherol.The list of ingredients is subject to change, please consult the packaging of the product purchased."
cleanser, https://www.sephora.com/product/take-day-off-micellar-cleansing-towelettes-for-face-eyes-P406924?skuId=1802354&icid2=products%20grid:p406924:product                                                       , CLINIQUE                  , Take The Day Off™ Micellar Cleansing Makeup Remover Wipes for Face & Eyes                       , "Water, Isopropyl Palmitate, Pentylene Glycol, Dimethicone, Trisiloxane, Methyl Glucose Sesquistearate, Peg-20 Methyl Glucose Sesquistearate, Caprylyl Glycol, Arginine, Hexylene Glycol, Sorbic Acid, Disodium Edta, Phenoxyethanol.Please be aware that ingredient lists may change or vary from time to time. Please refer to the ingredient list on the product package you receive for the most up-to-date list of ingredients. Water, Isopropyl Palmitate, Pentylene Glycol, Dimethicone, Trisiloxane, Methyl Glucose Sesquistearate, Peg-20 Methyl Glucose Sesquistearate, Caprylyl Glycol, Arginine, Hexylene Glycol, Sorbic Acid, Disodium Edta, Phenoxyethanol.Please be aware that ingredient lists may change or vary from time to time. Please refer to the ingredient list on the product package you receive for the most up-to-date list of ingredients."
cleanser, https://www.sephora.com/product/creamy-gentle-exfoliating-pore-perfecting-cleanser-with-salicylic-acid-P507131?skuId=2701050&icid2=products%20grid:p507131:product                                         , Peace Out                 , Creamy Gentle Exfoliating Pore Perfecting Cleanser with Salicylic Acid                          , "-Salicylic Acid: Gently exfoliates skin and refines the look of pores.-Niacinamide: Minimizes the appearance of pores and calms oily, clogged skin.-Hyaluronic Acid: Delivers hydration, leaving skin feeling smooth and supple.Water/Aqua/Eau, Sodium Cocoyl Isethionate, Propanediol, Cocamidopropyl Betaine, Myristic Acid, Diglycerin, Stearic Acid, Cellulose Acetate, Caprylic/Capric Triglyceride, Ammonium Acryloyldimethyltaurate/VP Copolymer, Zea Mays (Corn) Starch, Sodium Lauroyl Methyl Isethionate, Caprylyl Glycol, Glyceryl Caprylate, Sodium Methyl Oleoyl Taurate, Cocamidopropyl Dimethylamine, Coconut Acid, Ethylhexylglycerin, Betaine, Niacinamide, Glyceryl Dibehenate, Potassium Hydroxide, Salicylic Acid, Coco-Glucoside, Lauryl Glucoside, Tribehenin, Sodium Isethionate, Sodium PCA, Glyceryl Behenate, Palmitic Acid, Sodium Lactate, PCA, Sodium Benzoate, Lauric Acid, Serine, Alanine, Glycine, Sodium Hyaluronate, Glutamic Acid, Lysine HCl, Threonine, Arginine, Proline, Alcohol, Citric Acid, Sodium Carboxymethyl Starch, Sodium Chloride, Sodium Citrate.The list of ingredients is subject to change, please consult the packaging of the product purchased. -Salicylic Acid: Gently exfoliates skin and refines the look of pores.-Niacinamide: Minimizes the appearance of pores and calms oily, clogged skin.-Hyaluronic Acid: Delivers hydration, leaving skin feeling smooth and supple.Water/Aqua/Eau, Sodium Cocoyl Isethionate, Propanediol, Cocamidopropyl Betaine, Myristic Acid, Diglycerin, Stearic Acid, Cellulose Acetate, Caprylic/Capric Triglyceride, Ammonium Acryloyldimethyltaurate/VP Copolymer, Zea Mays (Corn) Starch, Sodium Lauroyl Methyl Isethionate, Caprylyl Glycol, Glyceryl Caprylate, Sodium Methyl Oleoyl Taurate, Cocamidopropyl Dimethylamine, Coconut Acid, Ethylhexylglycerin, Betaine, Niacinamide, Glyceryl Dibehenate, Potassium Hydroxide, Salicylic Acid, Coco-Glucoside, Lauryl Glucoside, Tribehenin, Sodium Isethionate, Sodium PCA, Glyceryl Behenate, Palmitic Acid, Sodium Lactate, PCA, Sodium Benzoate, Lauric Acid, Serine, Alanine, Glycine, Sodium Hyaluronate, Glutamic Acid, Lysine HCl, Threonine, Arginine, Proline, Alcohol, Citric Acid, Sodium Carboxymethyl Starch, Sodium Chloride, Sodium Citrate.The list of ingredients is subject to change, please consult the packaging of the product purchased."
cleanser, https://www.sephora.com/product/facegym-electro-lite-energizing-brightening-face-cleanser-P476674?skuId=2502938&icid2=products%20grid:p476674:product                                                      , FaceGym                   , Electro-Lite Enzyme Brightening Gel Cleanser                                                    , "-Papaya Enzymes and Hydroclay: Intensively cleanse, gently exfoliate, and visibly refine skin’s texture.-Red Clover Extract: Visibly minimizes sebum and shrinks pores.-Magnesium and Calcium Electrolytes: Soothe, hydrate, and replenish skin with a non-stripping 5.5 pH level.Aqua/Water/Eau, Glycerin, Glycolipids, Hectorite, Propanediol, Sodium Cocoyl Apple Amino Acids, Betaine, Isopentyldiol, Disodium Cocoyl Glutamate, Papain, Hordeum Distichon (Barley) Extract, Melissa Officinalis (Lemon Balm) Leaf Extract, Trifolium Pratense (Clover) Flower Extract, Carrageenan, Coco-Glucoside, Glyceryl Oleate, Xanthan Gum, Hexylene Glycol, Calcium PCA, Magnesium PCA, Tetrasodium Glutamate Diacetate, 1,2-Hexanediol, Caprylyl Glycol, Carbomer, Algin, Disodium Rutinyl Disulfate, Tocopherol, Hydrogenated Vegetable Glycerides Citrate, Phenoxyethanol, Hydroxyacetophenone, Sodium Benzoate, Citric Acid.The list of ingredients is subject to change, please consult the packaging of the product purchased. -Papaya Enzymes and Hydroclay: Intensively cleanse, gently exfoliate, and visibly refine skin’s texture.-Red Clover Extract: Visibly minimizes sebum and shrinks pores.-Magnesium and Calcium Electrolytes: Soothe, hydrate, and replenish skin with a non-stripping 5.5 pH level.Aqua/Water/Eau, Glycerin, Glycolipids, Hectorite, Propanediol, Sodium Cocoyl Apple Amino Acids, Betaine, Isopentyldiol, Disodium Cocoyl Glutamate, Papain, Hordeum Distichon (Barley) Extract, Melissa Officinalis (Lemon Balm) Leaf Extract, Trifolium Pratense (Clover) Flower Extract, Carrageenan, Coco-Glucoside, Glyceryl Oleate, Xanthan Gum, Hexylene Glycol, Calcium PCA, Magnesium PCA, Tetrasodium Glutamate Diacetate, 1,2-Hexanediol, Caprylyl Glycol, Carbomer, Algin, Disodium Rutinyl Disulfate, Tocopherol, Hydrogenated Vegetable Glycerides Citrate, Phenoxyethanol, Hydroxyacetophenone, Sodium Benzoate, Citric Acid.The list of ingredients is subject to change, please consult the packaging of the product purchased."
cleanser, https://www.sephora.com/product/elemis-mini-dynamic-gentle-resurfacing-pads-with-lactic-acid-P510341?skuId=2759017&icid2=products%20grid:p510341:product                                                   , Elemis                    , Mini Dynamic Gentle Resurfacing Pads with Lactic Acid                                           , "-Patented Tri-Enzyme Technology: Effectively breaks up the accumulation of dead skin cells.-Lactic Acid: Gently exfoliating AHA improves the look of skin tone and texture.-Probiotic Ferment Complex: Supports the skin’s renewal process.Aqua/Water/Eau, Butylene Glycol, Lactococcus Ferment Lysate, Polysorbate 20, Methyl Gluceth-20, Lactic Acid, Phenoxyethanol, Betaine, Sodium Hydroxide, Propylene Glycol, Disodium EDTA, Benzoic Acid, Fragrance (Parfum), Dehydroacetic Acid, Ethylhexylglycerin, Papain, Saponins, Sodium Benzoate, Sodium Chloride, Glycerin, Behenyl Alcohol, Butyrospermum Parkii (Shea) Butter, Hydrogenated Castor Oil, Stearyl Alcohol, Poria Cocos Extract, Protease, Saponaria Officinalis Leaf Extract, Subtilisin, Tocopheryl Acetate. -Patented Tri-Enzyme Technology: Effectively breaks up the accumulation of dead skin cells.-Lactic Acid: Gently exfoliating AHA improves the look of skin tone and texture.-Probiotic Ferment Complex: Supports the skin’s renewal process.Aqua/Water/Eau, Butylene Glycol, Lactococcus Ferment Lysate, Polysorbate 20, Methyl Gluceth-20, Lactic Acid, Phenoxyethanol, Betaine, Sodium Hydroxide, Propylene Glycol, Disodium EDTA, Benzoic Acid, Fragrance (Parfum), Dehydroacetic Acid, Ethylhexylglycerin, Papain, Saponins, Sodium Benzoate, Sodium Chloride, Glycerin, Behenyl Alcohol, Butyrospermum Parkii (Shea) Butter, Hydrogenated Castor Oil, Stearyl Alcohol, Poria Cocos Extract, Protease, Saponaria Officinalis Leaf Extract, Subtilisin, Tocopheryl Acetate."
cleanser, https://www.sephora.com/product/bobbi-brown-mini-soothing-cleansing-oil-P509395?skuId=2740470&icid2=products%20grid:p509395:product                                                                        , Bobbi Brown               , Mini Soothing Cleansing Oil                                                                     , "-Meadowfoam Seed Oil: Softens skin with a lightweight feel.-Tamanu Oil: Comforts with its rich emollience.-Tsubaki Oil: Nourishes.Isopropyl Palmitate, Pentaerythrityl Tetraethylhexanoate, Polybutene, Peg-20 Glyceryl Triisostearate, Isohexadecane, PEG-8 Diisostearate, Aleurites Moluccanus Seed Oil, PEG-12 Diisostearate, Tocopherol, Limnanthes Alba (Meadowfoam) Seed Oil, Olea Europaea (Olive) Fruit Oil, Helianthus Annuus (Sunflower) Seed Oil, Methyldihydrojasmonate, Simmondsia Chinensis (Jojoba) Seed Oil, Jasminum Officinale (Jasmine) Flower Wax, Calophyllum Inophyllum Seed Oil, Camellia Japonica Seed Oil, Lavandula Hybrida Oil, Lavandula Angustifolia (Lavender) Oil, Bisabolol, Glycerin, Glyceryl Laurate, Water/Aqua/Eau, Pentylene Glycol, Dipentaerythrityl Tri-Polyhydroxystearate, Linalyl Acetate, Tocopheryl Acetate. -Meadowfoam Seed Oil: Softens skin with a lightweight feel.-Tamanu Oil: Comforts with its rich emollience.-Tsubaki Oil: Nourishes.Isopropyl Palmitate, Pentaerythrityl Tetraethylhexanoate, Polybutene, Peg-20 Glyceryl Triisostearate, Isohexadecane, PEG-8 Diisostearate, Aleurites Moluccanus Seed Oil, PEG-12 Diisostearate, Tocopherol, Limnanthes Alba (Meadowfoam) Seed Oil, Olea Europaea (Olive) Fruit Oil, Helianthus Annuus (Sunflower) Seed Oil, Methyldihydrojasmonate, Simmondsia Chinensis (Jojoba) Seed Oil, Jasminum Officinale (Jasmine) Flower Wax, Calophyllum Inophyllum Seed Oil, Camellia Japonica Seed Oil, Lavandula Hybrida Oil, Lavandula Angustifolia (Lavender) Oil, Bisabolol, Glycerin, Glyceryl Laurate, Water/Aqua/Eau, Pentylene Glycol, Dipentaerythrityl Tri-Polyhydroxystearate, Linalyl Acetate, Tocopheryl Acetate."
cleanser, https://www.sephora.com/product/biossance-squalane-bha-pore-minimizing-toner-P471003?skuId=2457547&icid2=products%20grid:p471003:product                                                                   , Biossance                 , 2% BHA Pore Minimizing Toner + Squalane                                                         , "- White Willow Bark Extract: Helps unclog pores and manage excess oil.
                                                                                                                                                                                                                                                                                                                                                     
                                                                                                                                                                                                                                                                                                                                                     - Caviar Lime Extract: A natural source of alpha hydroxy acids (AHAs), polyphenols, and flavonoids that clears away dead surface skin.
                                                                                                                                                                                                                                                                                                                                                     
                                                                                                                                                                                                                                                                                                                                                     - Sugarcane-Derived Squalane: Delivers weightless moisture without shine.Water/Aqua/Eau, Salix Alba (Willow) Bark Extract, Glycerin, Cucumis Sativus (Cucumber) Fruit Water, Squalane, Sorbitan Oleate Decylglucoside Crosspolymer, Betaine Salicylate, Microcitrus Australasica Fruit Extract, Rosmarinus Officinalis (Rosemary) Leaf Water, Lavandula Angustifolia (Lavender) Flower Water, Sodium Hyaluronate, Melia Azadirachta Leaf Extract, Melissa Officinalis Leaf Oil, Curcuma Longa (Turmeric) Root Extract, Coccinia Indica Fruit Extract, Melia Azadirachta Flower Extract, Solanum Melongena (Eggplant) Fruit Extract, Ocimum Basilicum (Basil) Flower/Leaf Extract, Amber Powder, Corallina Officinalis Extract, Sodium Chloride, Citric Acid, Sodium Gluconate, Sodium Benzoate, Potassium Sorbate, Pelargonium Graveolens Oil, Citronellol.The list of ingredients is subject to change, please consult the packaging of the product purchased. - White Willow Bark Extract: Helps unclog pores and manage excess oil.
                                                                                                                                                                                                                                                                                                                                                     
                                                                                                                                                                                                                                                                                                                                                     - Caviar Lime Extract: A natural source of alpha hydroxy acids (AHAs), polyphenols, and flavonoids that clears away dead surface skin.
                                                                                                                                                                                                                                                                                                                                                     
                                                                                                                                                                                                                                                                                                                                                     - Sugarcane-Derived Squalane: Delivers weightless moisture without shine.Water/Aqua/Eau, Salix Alba (Willow) Bark Extract, Glycerin, Cucumis Sativus (Cucumber) Fruit Water, Squalane, Sorbitan Oleate Decylglucoside Crosspolymer, Betaine Salicylate, Microcitrus Australasica Fruit Extract, Rosmarinus Officinalis (Rosemary) Leaf Water, Lavandula Angustifolia (Lavender) Flower Water, Sodium Hyaluronate, Melia Azadirachta Leaf Extract, Melissa Officinalis Leaf Oil, Curcuma Longa (Turmeric) Root Extract, Coccinia Indica Fruit Extract, Melia Azadirachta Flower Extract, Solanum Melongena (Eggplant) Fruit Extract, Ocimum Basilicum (Basil) Flower/Leaf Extract, Amber Powder, Corallina Officinalis Extract, Sodium Chloride, Citric Acid, Sodium Gluconate, Sodium Benzoate, Potassium Sorbate, Pelargonium Graveolens Oil, Citronellol.The list of ingredients is subject to change, please consult the packaging of the product purchased."
cleanser, https://www.sephora.com/product/kombucha-10-37-aha-power-exfoliant-with-lactic-acid-glycolic-acid-P502479?skuId=2600369&icid2=products%20grid:p502479:product                                              , Youth To The People       , Kombucha + 10% AHA Liquid Exfoliant with Lactic Acid and Glycolic Acid                          , "-Lactic Acid 7% and Glyccolic Acid 3%: Visibly nourish dull skin and fade the appearance of dark spots.-Kombucha Black Tea Ferment: Works to renew skin's radiant glow and defend against free radicals.-Betaine: Helps your skin attract and maintain moisture.Water/Aqua/Eau, Pentylene Glycol, Lactic Acid, Glycolic Acid, Propanediol, Butylene Glycol, L-Arginine, Sodium Hydroxide, Betaine, Glycerin, Triethyl Citrate, Saccharomyces/Xylinum/Black Tea Ferment, Pichia Ferment Lysate Filtrate, Tetrasodium Glutamate Diacetate, Potassium Sorbate, Ethylhexylglycerin, Phenoxyethanol, Sodium Chloride, Sodium Carbonate..The list of ingredients is subject to change, please consult the packaging of the product purchased. -Lactic Acid 7% and Glyccolic Acid 3%: Visibly nourish dull skin and fade the appearance of dark spots.-Kombucha Black Tea Ferment: Works to renew skin's radiant glow and defend against free radicals.-Betaine: Helps your skin attract and maintain moisture.Water/Aqua/Eau, Pentylene Glycol, Lactic Acid, Glycolic Acid, Propanediol, Butylene Glycol, L-Arginine, Sodium Hydroxide, Betaine, Glycerin, Triethyl Citrate, Saccharomyces/Xylinum/Black Tea Ferment, Pichia Ferment Lysate Filtrate, Tetrasodium Glutamate Diacetate, Potassium Sorbate, Ethylhexylglycerin, Phenoxyethanol, Sodium Chloride, Sodium Carbonate..The list of ingredients is subject to change, please consult the packaging of the product purchased."
cleanser, https://www.sephora.com/product/goat-milk-moisturizing-cleanser-P440305?skuId=2172658&icid2=products%20grid:p440305:product                                                                                , Kate Somerville           , Goat Milk Moisturizing Cleanser                                                                 , "-Goat Milk: Soothes dry, sensitive skin with natural milk proteins.-Manuka Honey: Nurtures skin without any tightness, dryness, or irritation.Water Sodium Cocoyl Isethionate, Cocamidopropyl Hydroxysultaine, Glycerin, Polyglyceryl-3 Methylglucose Distearate, Betaine, Glyceryl Distearate, Vitis Vinifera (Grape) Seed Oil, Simmondsia Chinensis (Jojoba) Seed Oil, Persea Gratissima (Avocado) Oil, Cocos Nucifera (Coconut) Oil, Caprylic/Capric Triglyceride, Xylitylglucoside, Propanediol, Polyacrylate Crosspolymer-6, Glyceryl Stearate, Cetearyl Alcohol, Caprae Lac (Goat Milk, Lait de Chèvre), Lactose, Milk Protein, Lactic Acid, Tocopherol, Mel Extract (Honey Extract, Extrait de Miel), Rosmarinus Officinalis (Rosemary) Leaf Extract, Helianthus Annuus (Sunflower) Extract, Bisabolol, Aloe Barbadensis Leaf Juice, Sodium Lauroyl Glutamate, Oryza Sativa (Rice) Bran Extract, Xylitol, 1,2-Hexanediol, Anhydroxylitol, Parfum/Fragrance, Stearic Acid, Disodium EDTA, Caprylhydroxamic Acid, Xanthan Gum, t-butyl Alcohol, Benzyl Salicylate. -Goat Milk: Soothes dry, sensitive skin with natural milk proteins.-Manuka Honey: Nurtures skin without any tightness, dryness, or irritation.Water Sodium Cocoyl Isethionate, Cocamidopropyl Hydroxysultaine, Glycerin, Polyglyceryl-3 Methylglucose Distearate, Betaine, Glyceryl Distearate, Vitis Vinifera (Grape) Seed Oil, Simmondsia Chinensis (Jojoba) Seed Oil, Persea Gratissima (Avocado) Oil, Cocos Nucifera (Coconut) Oil, Caprylic/Capric Triglyceride, Xylitylglucoside, Propanediol, Polyacrylate Crosspolymer-6, Glyceryl Stearate, Cetearyl Alcohol, Caprae Lac (Goat Milk, Lait de Chèvre), Lactose, Milk Protein, Lactic Acid, Tocopherol, Mel Extract (Honey Extract, Extrait de Miel), Rosmarinus Officinalis (Rosemary) Leaf Extract, Helianthus Annuus (Sunflower) Extract, Bisabolol, Aloe Barbadensis Leaf Juice, Sodium Lauroyl Glutamate, Oryza Sativa (Rice) Bran Extract, Xylitol, 1,2-Hexanediol, Anhydroxylitol, Parfum/Fragrance, Stearic Acid, Disodium EDTA, Caprylhydroxamic Acid, Xanthan Gum, t-butyl Alcohol, Benzyl Salicylate."
cleanser, https://www.sephora.com/product/exfoliation-icons-kit-for-clear-brighter-looking-skin-P515549?skuId=2851954&icid2=products%20grid:p515549:product                                                          , Paula's Choice            , "Exfoliation Icons Kit for clear, brighter looking skin"                                        , "-Salicylic Acid (BHA): Gently dissolves breakout-causing buildup deep within pores.-Mandelic Acid (AHA): Visibly resurfaces texture and fades the look of multiple types of discoloration.-Green Tea: Quickly calms redness and soothes barrier.2% BHA Liquid:Water (Aqua), Methylpropanediol, Butylene Glycol, Salicylic Acid, Polysorbate 20, Camellia Oleifera (Green Tea) Leaf Extract, Sodium Hydroxide, Tetrasodium EDTA.6% Mandelic Acid + 2% Lactic Acid:Water/Aqua/Eau, 2,3-Butanediol, Mandelic Acid, Lactic Acid, Sodium Hydroxide, Myrica Cerifera (Bayberry) Fruit Extract, Akebia Quinata (Chocolate Vine) Stem Extract, Prunus Lannesiana (Cherry Blossom) Flower Extract, Lactobacillus Ferment Lysate, Saccharomyces Lysate, Achillea Millefolium (Yarrow) Extract, Saccharide Isomerate, Arginine, Hydroxyacetophenone, Butylene Glycol, Sodium Phytate, Pentylene Glycol, Xanthan Gum, Citric Acid, Sodium Citrate, 1,2-Hexanediol, Caprylyl Glycol, Sodium Benzoate. -Salicylic Acid (BHA): Gently dissolves breakout-causing buildup deep within pores.-Mandelic Acid (AHA): Visibly resurfaces texture and fades the look of multiple types of discoloration.-Green Tea: Quickly calms redness and soothes barrier.2% BHA Liquid:Water (Aqua), Methylpropanediol, Butylene Glycol, Salicylic Acid, Polysorbate 20, Camellia Oleifera (Green Tea) Leaf Extract, Sodium Hydroxide, Tetrasodium EDTA.6% Mandelic Acid + 2% Lactic Acid:Water/Aqua/Eau, 2,3-Butanediol, Mandelic Acid, Lactic Acid, Sodium Hydroxide, Myrica Cerifera (Bayberry) Fruit Extract, Akebia Quinata (Chocolate Vine) Stem Extract, Prunus Lannesiana (Cherry Blossom) Flower Extract, Lactobacillus Ferment Lysate, Saccharomyces Lysate, Achillea Millefolium (Yarrow) Extract, Saccharide Isomerate, Arginine, Hydroxyacetophenone, Butylene Glycol, Sodium Phytate, Pentylene Glycol, Xanthan Gum, Citric Acid, Sodium Citrate, 1,2-Hexanediol, Caprylyl Glycol, Sodium Benzoate."
