Category, URL                                                                                                                                                                                                        , Brand                     , Product Name                                                                                    , Ingredients
cleanser, https://www.sephora.com/product/kale-spinach-green-tea-age-prevention-cleanser-P411387?skuId=1863588&icid2=products%20grid:p411387:product                                                                 , Youth To The People       , Superfood Gentle Antioxidant Refillable Cleanser                                                , "Water/Aqua/Eau, Cocamidopropyl Hydroxysultaine, Sodium Cocoyl Glutamate, Sorbeth-230 Tetraoleate, Polysorbate 20, Sodium Chloride, Aloe Barbadensis Leaf (Aloe Vera) Juice Powder, Brassica Oleracea Acephala (Kale) Leaf Extract, Spinacia Oleracea (Spinach) Leaf Extract, Camellia Sinensis (Green Tea) Leaf Extract, Medicago Sativa (Alfalfa) Extract, Chamomilla Recutita (Matricaria) Flower Extract, Tetrahexyldecyl Ascorbate (Vitamin C), Glycerin, Panthenol (Vitamin B5), Tocopheryl Acetate (Vitamin E), Decyl Glucoside, Sorbitan Laurate, Tetrasodium Glutamate Diacetate, Gluconolactone, Ethylhexylglycerin, Maltodextrin, Citric Acid, Phenoxyethanol, Potassium Sorbate, Sodium Benzoate, Gardenia Jasminoides (Jasmine) Fruit Extract, Fragrance/Parfum, Sodium Hydroxide, Sodium Glycolate, Sodium Formate, Hexyl Cinnamal, Linalool, Limonene, Chlorophyllin-Copper Complex (CI 75810)..The list of ingredients is subject to change, please consult the packaging of the product purchased. Water/Aqua/Eau, Cocamidopropyl Hydroxysultaine, Sodium Cocoyl Glutamate, Sorbeth-230 Tetraoleate, Polysorbate 20, Sodium Chloride, Aloe Barbadensis Leaf (Aloe Vera) Juice Powder, Brassica Oleracea Acephala (Kale) Leaf Extract, Spinacia Oleracea (Spinach) Leaf Extract, Camellia Sinensis (Green Tea) Leaf Extract, Medicago Sativa (Alfalfa) Extract, Chamomilla Recutita (Matricaria) Flower Extract, Tetrahexyldecyl Ascorbate (Vitamin C), Glycerin, Panthenol (Vitamin B5), Tocopheryl Acetate (Vitamin E), Decyl Glucoside, Sorbitan Laurate, Tetrasodium Glutamate Diacetate, Gluconolactone, Ethylhexylglycerin, Maltodextrin, Citric Acid, Phenoxyethanol, Potassium Sorbate, Sodium Benzoate, Gardenia Jasminoides (Jasmine) Fruit Extract, Fragrance/Parfum, Sodium Hydroxide, Sodium Glycolate, Sodium Formate, Hexyl Cinnamal, Linalool, Limonene, Chlorophyllin-Copper Complex (CI 75810)..The list of ingredients is subject to change, please consult the packaging of the product purchased."
cleanser, https://www.sephora.com/product/the-ordinary-deciem-glycolic-acid-7-toning-solution-P427406?skuId=2031508&icid2=products%20grid:p427406:product                                                            , The Ordinary              , Glycolic Acid 7% Exfoliating and Brightening Daily Toner                                        , "-Glycolic Acid: An alpha hydroxy acid that exfoliates the skin.-Tasmanian Pepperberry Derivative: Helps reduce irritation associated with acid use.-Ginseng Root and Aloe Vera: Offer both visible radiance and soothing benefits.Aqua (Water), Glycolic Acid, Rosa damascena flower water, Centaurea cyanus flower water, Aloe Barbadensis Leaf Water, Propanediol, Glycerin, Triethanolamine, Aminomethyl Propanol, Panax Ginseng Root Extract, Tasmannia Lanceolata Fruit/Leaf Extract, Aspartic Acid, Alanine, Glycine, Serine, Valine, Isoleucine, Proline, Threonine, Histidine, Phenylalanine, Glutamic Acid, Arginine, PCA, Sodium PCA, Sodium Lactate, Fructose, Glucose, Sucrose, Urea, Hexyl Nicotinate, Dextrin, Citric Acid, Polysorbate 20, Gellan Gum, Trisodium Ethylenediamine Disuccinate, Sodium Chloride, Hexylene Glycol, Potassium Sorbate, Sodium Benzoate, 1,2-Hexanediol, Caprylyl Glycol.This formulation features a Tasmanian Pepperberry derivative, a plant extract that helps soothe the skin and reduce irritation commonly associated with exfoliation, making it suitable for frequent use. Additionally, the presence of this natural ingredient may cause seasonal color variation in the formula. With a carefully calibrated pH of approximately 3.6, the toner has an optimal balance between salt and acidity. -Glycolic Acid: An alpha hydroxy acid that exfoliates the skin.-Tasmanian Pepperberry Derivative: Helps reduce irritation associated with acid use.-Ginseng Root and Aloe Vera: Offer both visible radiance and soothing benefits.Aqua (Water), Glycolic Acid, Rosa damascena flower water, Centaurea cyanus flower water, Aloe Barbadensis Leaf Water, Propanediol, Glycerin, Triethanolamine, Aminomethyl Propanol, Panax Ginseng Root Extract, Tasmannia Lanceolata Fruit/Leaf Extract, Aspartic Acid, Alanine, Glycine, Serine, Valine, Isoleucine, Proline, Threonine, Histidine, Phenylalanine, Glutamic Acid, Arginine, PCA, Sodium PCA, Sodium Lactate, Fructose, Glucose, Sucrose, Urea, Hexyl Nicotinate, Dextrin, Citric Acid, Polysorbate 20, Gellan Gum, Trisodium Ethylenediamine Disuccinate, Sodium Chloride, Hexylene Glycol, Potassium Sorbate, Sodium Benzoate, 1,2-Hexanediol, Caprylyl Glycol.This formulation features a Tasmanian Pepperberry derivative, a plant extract that helps soothe the skin and reduce irritation commonly associated with exfoliation, making it suitable for frequent use. Additionally, the presence of this natural ingredient may cause seasonal color variation in the formula. With a carefully calibrated pH of approximately 3.6, the toner has an optimal balance between salt and acidity."
cleanser, https://www.sephora.com/product/tatcha-the-rice-wash-skin-softening-cleanser-P461537?skuId=2382232&icid2=products%20grid:p461537:product                                                                   , Tatcha                    , The Rice Wash Skin-Softening Cleanser                                                           , "-Blend of Japanese Algae: Leaves skin feeling soft, comforted, and nourished.-Hyaluronic Acid: Helps skin look smooth and plump with hydration.-Tatcha's Signature Hadasei-3: Restores a visibly healthy-, youthful-looking radiance.Aqua/Water/Eau, Microcrystalline Cellulose, Propanediol, Sodium Cocoyl Glutamate, Glycerin, Acrylates Copolymer, Sodium Caproyl Methyltaurate, Coco-Betaine, Parfum/Fragrance, Saccharomyces/Camellia Sinensis Leaf/Cladosiphon Okamuranus/Rice Ferment Filtrate*, Oryza Sativa (Rice) Powder, Chondrus Crispus Extract, Sodium Hyaluronate, Betaphycus Gelatinum Extract, Lauryl Glucoside, Potassium Hydroxide, Polyquaternium-39, Disodium Edta, Phenoxyethanol, Ethylhexylglycerin, Sodium Benzoate, Sodium Carbonate, Alcohol.*Hadasei-3.The list of ingredients is subject to change, please consult the packaging of the product purchased. -Blend of Japanese Algae: Leaves skin feeling soft, comforted, and nourished.-Hyaluronic Acid: Helps skin look smooth and plump with hydration.-Tatcha's Signature Hadasei-3: Restores a visibly healthy-, youthful-looking radiance.Aqua/Water/Eau, Microcrystalline Cellulose, Propanediol, Sodium Cocoyl Glutamate, Glycerin, Acrylates Copolymer, Sodium Caproyl Methyltaurate, Coco-Betaine, Parfum/Fragrance, Saccharomyces/Camellia Sinensis Leaf/Cladosiphon Okamuranus/Rice Ferment Filtrate*, Oryza Sativa (Rice) Powder, Chondrus Crispus Extract, Sodium Hyaluronate, Betaphycus Gelatinum Extract, Lauryl Glucoside, Potassium Hydroxide, Polyquaternium-39, Disodium Edta, Phenoxyethanol, Ethylhexylglycerin, Sodium Benzoate, Sodium Carbonate, Alcohol.*Hadasei-3.The list of ingredients is subject to change, please consult the packaging of the product purchased."
cleanser, https://www.sephora.com/product/sos-save-our-skin-daily-rescue-facial-spray-P448852?skuId=2527844&icid2=products%20grid:p448852:product                                                                    , Tower 28 Beauty           , SOS Daily Rescue Facial Spray with Hypochlorous Acid                                            , "-Hypochlorous Acid: Naturally produced by the body's immune system, it's anti-inflammatory and antibacterial properties help defend your skin from harmful bacteria, reduce redness, and soothe irritation.-Water and Sodium Chloride: Act as the optimal delivery solution for hypochlorous acid.Water, Sodium Chloride, Hypochlorous Acid.The list of ingredients is subject to change, please consult the packaging of the product purchased. -Hypochlorous Acid: Naturally produced by the body's immune system, it's anti-inflammatory and antibacterial properties help defend your skin from harmful bacteria, reduce redness, and soothe irritation.-Water and Sodium Chloride: Act as the optimal delivery solution for hypochlorous acid.Water, Sodium Chloride, Hypochlorous Acid.The list of ingredients is subject to change, please consult the packaging of the product purchased."
cleanser, https://www.sephora.com/product/paula-s-choice-skin-perfecting-2-bha-liquid-exfoliant-P469502?skuId=2421360&icid2=products%20grid:p469502:product                                                          , Paula's Choice            , Skin Perfecting 2% BHA Exfoliating Toner for Clear Skin                                         , "-Salicylic Acid (BHA) 2%: Penetrates pores to clear blemish-causing buildup and shed dead skin.-Green Tea: A potent antioxidant that soothes irritated skin while improving visible signs of aging.-Methylpropanediol: Hydrates while visibly enhancing the skin’s glow and the formula’s penetration.Water (Aqua), Methylpropanediol, Butylene Glycol, Salicylic Acid, Polysorbate 20, Camellia Oleifera (Green Tea) Leaf Extract, Sodium Hydroxide, Tetrasodium EDTA. -Salicylic Acid (BHA) 2%: Penetrates pores to clear blemish-causing buildup and shed dead skin.-Green Tea: A potent antioxidant that soothes irritated skin while improving visible signs of aging.-Methylpropanediol: Hydrates while visibly enhancing the skin’s glow and the formula’s penetration.Water (Aqua), Methylpropanediol, Butylene Glycol, Salicylic Acid, Polysorbate 20, Camellia Oleifera (Green Tea) Leaf Extract, Sodium Hydroxide, Tetrasodium EDTA."
cleanser, https://www.sephora.com/product/the-ordinary-glucoside-foaming-cleanser-P505274?skuId=2644151&icid2=products%20grid:p505274:product                                                                        , The Ordinary              , Glucoside Gentle Foaming Cleanser for Oily Skin                                                 , "-Decyl-Glucoside and Coco-Glucoside: Help remove dirt and other impurities.Aqua (Water), Decyl Glucoside, Coco Glucoside, Xanthan Gum, Tocopherol, Phytic Acid, Benzyl Alcohol, Ethylhexylglycerin. -Decyl-Glucoside and Coco-Glucoside: Help remove dirt and other impurities.Aqua (Water), Decyl Glucoside, Coco Glucoside, Xanthan Gum, Tocopherol, Phytic Acid, Benzyl Alcohol, Ethylhexylglycerin."
cleanser, https://www.sephora.com/product/waterbank-foaming-gel-cleanser-with-hyaluronic-acid-P514497?skuId=2837110&icid2=products%20grid:p514497:product                                                            , LANEIGE                   , Water Bank Gentle Gel Cleanser with Hyaluronic Acid                                             , "-Blue Hyaluronic Acid (Blue HA): Delivers effective, long-lasting hydration.-Allantoin: Soothes skin.-Amino Acid Complex: Supports skin’s barrier.Water/Aqua/Eau, Glycerin, Lauryl Hydroxysultaine, Sodium Cocoyl Isethionate, Sodium Methyl Cocoyl Taurate, Glyceryl Stearate SE, Caprylyl/Capryl Glucoside, Lauryl Betaine, Sodium Chloride, Hydroxypropyl Starch Phosphate, Polyglyceryl-6 Caprylate, Polyglyceryl-4 Caprate, Trihydroxystearin, Glycol Distearate, 1,2-Hexanediol, Polyquaternium-7, Citric Acid, Xanthan Gum, Cetearyl Olivate, Sorbitan Olivate, Allantoin, Hydrolyzed Hyaluronic Acid, Arginine, Aspartic Acid, Glutamic Acid, Sodium Benzoate, Panthenol. -Blue Hyaluronic Acid (Blue HA): Delivers effective, long-lasting hydration.-Allantoin: Soothes skin.-Amino Acid Complex: Supports skin’s barrier.Water/Aqua/Eau, Glycerin, Lauryl Hydroxysultaine, Sodium Cocoyl Isethionate, Sodium Methyl Cocoyl Taurate, Glyceryl Stearate SE, Caprylyl/Capryl Glucoside, Lauryl Betaine, Sodium Chloride, Hydroxypropyl Starch Phosphate, Polyglyceryl-6 Caprylate, Polyglyceryl-4 Caprate, Trihydroxystearin, Glycol Distearate, 1,2-Hexanediol, Polyquaternium-7, Citric Acid, Xanthan Gum, Cetearyl Olivate, Sorbitan Olivate, Allantoin, Hydrolyzed Hyaluronic Acid, Arginine, Aspartic Acid, Glutamic Acid, Sodium Benzoate, Panthenol."
cleanser, https://www.sephora.com/product/glow-recipe-avocado-ceramide-moisture-barrier-cleanser-P503634?skuId=2661239&icid2=products%20grid:p503634:product                                                         , Glow Recipe               , Avocado Ceramide Moisture Barrier Cleanser                                                      , "-Ceramides: Support skin barrier health to visibly reduce redness and deliver long-lasting hydration.-Prebiotics and Postbiotics: Help visibly balance skin and strengthen skin’s barrier.-Colloidal Oatmeal and Avocado Oil: Hydrates, soothes, and retains skin moisture to deeply nurture skin.Water/Aqua/Eau, Glycerin, Sodium Cocoyl Alaninate, Sodium Methyl Cocoyl Taurate, Acrylates/C10-30 Alkyl Acrylate Crosspolymer, Inulin, Butylene Glycol, Ceramide NP, Colloidal Oatmeal, Caprylyl Glycol, Lauryl Hydroxysultaine, Coco-Glucoside, Sodium Hyaluronate, Persea Gratissima (Avocado) Oil, Persea Gratissima (Avocado) Fruit Extract, Saccharide Isomerate, Micrococcus Lysate, Glyceryl Caprylate, Polyglyceryl-10 Laurate, Styrene/Acrylates Copolymer, Sodium Cocoyl Isethionate, 1,2-Hexanediol, Epidermidibacterium Keratini Ferment Filtrate, Quillaja Saponaria Bark Extract, Sodium Phytate, Lecithin, Dipotassium Glycyrrhizate, Citric Acid, Moringa Oleifera Seed Oil, Sodium Citrate, Butyl Avocadate, Arginine, Phytosphingosine, Hydrogenated Lecithin, Hydroxypropyltrimonium Hyaluronate, Mannose, Hydrolyzed Hyaluronic Acid, Sodium Acetylated Hyaluronate, Maltodextrin, Tocopherol, Hyaluronic Acid, Hydrolyzed Sodium Hyaluronate, Sodium Hyaluronate Crosspolymer, Potassium Hyaluronate, Xanthan Gum, Aloe Ferox Leaf Extract, Hexylene Glycol, Triacetin, Gardenia Florida Fruit Extract, Dextrin, Fragrance/Parfum*. *100% Naturally Derived FragranceThe list of ingredients is subject to change, please consult the packaging of the product purchased. -Ceramides: Support skin barrier health to visibly reduce redness and deliver long-lasting hydration.-Prebiotics and Postbiotics: Help visibly balance skin and strengthen skin’s barrier.-Colloidal Oatmeal and Avocado Oil: Hydrates, soothes, and retains skin moisture to deeply nurture skin.Water/Aqua/Eau, Glycerin, Sodium Cocoyl Alaninate, Sodium Methyl Cocoyl Taurate, Acrylates/C10-30 Alkyl Acrylate Crosspolymer, Inulin, Butylene Glycol, Ceramide NP, Colloidal Oatmeal, Caprylyl Glycol, Lauryl Hydroxysultaine, Coco-Glucoside, Sodium Hyaluronate, Persea Gratissima (Avocado) Oil, Persea Gratissima (Avocado) Fruit Extract, Saccharide Isomerate, Micrococcus Lysate, Glyceryl Caprylate, Polyglyceryl-10 Laurate, Styrene/Acrylates Copolymer, Sodium Cocoyl Isethionate, 1,2-Hexanediol, Epidermidibacterium Keratini Ferment Filtrate, Quillaja Saponaria Bark Extract, Sodium Phytate, Lecithin, Dipotassium Glycyrrhizate, Citric Acid, Moringa Oleifera Seed Oil, Sodium Citrate, Butyl Avocadate, Arginine, Phytosphingosine, Hydrogenated Lecithin, Hydroxypropyltrimonium Hyaluronate, Mannose, Hydrolyzed Hyaluronic Acid, Sodium Acetylated Hyaluronate, Maltodextrin, Tocopherol, Hyaluronic Acid, Hydrolyzed Sodium Hyaluronate, Sodium Hyaluronate Crosspolymer, Potassium Hyaluronate, Xanthan Gum, Aloe Ferox Leaf Extract, Hexylene Glycol, Triacetin, Gardenia Florida Fruit Extract, Dextrin, Fragrance/Parfum*. *100% Naturally Derived FragranceThe list of ingredients is subject to change, please consult the packaging of the product purchased."
cleanser, https://www.sephora.com/product/gentle-jelly-cleanser-P514790?skuId=2825388&icid2=products%20grid:p514790:product                                                                                          , SEPHORA COLLECTION        , Gentle Jelly Cleanser with with Prebiotics                                                      , "-Prebiotics: Helps to maintain skin hydration.Aqua (Water), Coco-Glucoside, Glycerin, Inulin, Xanthan Gum, Sodium Benzoate, Citric Acid, Potassium Sorbate, Aloe Barbadensis Leaf Juice Powder, Sodium Hydroxide.The list of ingredients is subject to change. Please consult the packaging of the product purchased. -Prebiotics: Helps to maintain skin hydration.Aqua (Water), Coco-Glucoside, Glycerin, Inulin, Xanthan Gum, Sodium Benzoate, Citric Acid, Potassium Sorbate, Aloe Barbadensis Leaf Juice Powder, Sodium Hydroxide.The list of ingredients is subject to change. Please consult the packaging of the product purchased."
cleanser, https://www.sephora.com/product/tower-28-sos-gentle-hydrating-gel-cleanser-makeup-remover-P512174?skuId=2780609&icid2=products%20grid:p512174:product                                                      , Tower 28 Beauty           , SOS Gentle Hydrating Gel Cleanser + Makeup Remover                                              , "-Minerals and Electrolytes (Zinc, Copper, Magnesium): Supports skin’s immunity and boosts hydration levels.-100% Pure Aloe Vera: Forms a protective barrier to retain moisture and soothe.-Oat: Naturally soothes irritation.Water/Aqua/Eau, Decyl Glucoside, Aloe Barbadensis Leaf Juice, Niacinamide, Caprylyl/Capryl Glucoside, Phenoxyethanol, Glycerin, Caprylyl Glycol, Citric Acid, Chlorphenesin, Magnesium Aspartate, Zinc Gluconate, Algin, Achillea Millefolium (Yarrow) Extract, Avena Sativa (Oat) Kernel Extract, Cardiospermum Halicacabum (Ballon Vine) Flower/Leaf/Vine Extract, Sapindus Mukorossi (Soapberry) Peel Extract, Panthenol, Copper Gluconate.The list of ingredients is subject to change. Please consult the packaging of the product purchased. -Minerals and Electrolytes (Zinc, Copper, Magnesium): Supports skin’s immunity and boosts hydration levels.-100% Pure Aloe Vera: Forms a protective barrier to retain moisture and soothe.-Oat: Naturally soothes irritation.Water/Aqua/Eau, Decyl Glucoside, Aloe Barbadensis Leaf Juice, Niacinamide, Caprylyl/Capryl Glucoside, Phenoxyethanol, Glycerin, Caprylyl Glycol, Citric Acid, Chlorphenesin, Magnesium Aspartate, Zinc Gluconate, Algin, Achillea Millefolium (Yarrow) Extract, Avena Sativa (Oat) Kernel Extract, Cardiospermum Halicacabum (Ballon Vine) Flower/Leaf/Vine Extract, Sapindus Mukorossi (Soapberry) Peel Extract, Panthenol, Copper Gluconate.The list of ingredients is subject to change. Please consult the packaging of the product purchased."
cleanser, https://www.sephora.com/product/blueberry-bounce-gentle-cleanser-P436359?skuId=2131803&icid2=products%20grid:p436359:product                                                                               , Glow Recipe               , Blueberry Bounce Gentle Cleanser                                                                , "-Blueberry Extract: Packed with antioxidants to protect skin against environmental stressors.-Hyaluronic Acid: Hydrates skin by holding up to 1,000 times its weight in moisture.-AHA: A blend of lactic acid (derived from plants) and glycolic acid that gently exfoliates and hydrates to reveal smoother, brighter skin over time by removing dead surface skin cells.Water, Palm Kernel/Coco Glucoside, Caulerpa Lentillifera (Seaweed) Extract, Sodium Hyaluronate, Vaccinium Angustifolium (Blueberry) Fruit Extract, Vaccinium Angustifolium (Blueberry) Fruit, Glycolic Acid, Lactic Acid, Physalis Peruviana (Groundcherry) Fruit Extract, Rubus Idaeus (Raspberry) Fruit Extract, Arctostaphylos Uva Ursi (Bearberry) Leaf Extract, Morus Nigra (Mulberry) Fruit Extract, Vaccinium Myrtillus (Bilberry) Fruit Extract, Beta-Glucan, Scutellaria Baicalensis (Skullcap) Root Extract, Paeonia Suffruticosa (Peony) Root Extract, Glycyrrhiza Glabra (Licorice) Root Extract, Betaine, Sodium Chloride, Fragrance.The list of ingredients is subject to change, please consult the packaging of the product purchased. -Blueberry Extract: Packed with antioxidants to protect skin against environmental stressors.-Hyaluronic Acid: Hydrates skin by holding up to 1,000 times its weight in moisture.-AHA: A blend of lactic acid (derived from plants) and glycolic acid that gently exfoliates and hydrates to reveal smoother, brighter skin over time by removing dead surface skin cells.Water, Palm Kernel/Coco Glucoside, Caulerpa Lentillifera (Seaweed) Extract, Sodium Hyaluronate, Vaccinium Angustifolium (Blueberry) Fruit Extract, Vaccinium Angustifolium (Blueberry) Fruit, Glycolic Acid, Lactic Acid, Physalis Peruviana (Groundcherry) Fruit Extract, Rubus Idaeus (Raspberry) Fruit Extract, Arctostaphylos Uva Ursi (Bearberry) Leaf Extract, Morus Nigra (Mulberry) Fruit Extract, Vaccinium Myrtillus (Bilberry) Fruit Extract, Beta-Glucan, Scutellaria Baicalensis (Skullcap) Root Extract, Paeonia Suffruticosa (Peony) Root Extract, Glycyrrhiza Glabra (Licorice) Root Extract, Betaine, Sodium Chloride, Fragrance.The list of ingredients is subject to change, please consult the packaging of the product purchased."
cleanser, https://www.sephora.com/product/the-inkey-list-hydrating-cream-to-milk-cleanser-with-hyaluronic-acid-P517061?skuId=2866259&icid2=products%20grid:p517061:product                                           , The INKEY List            , Hydrating Cream-To-Milk Cleanser with Hyaluronic Acid                                           , "-Rice Milk 5%: Softens and supports skin’s barrier.-Hyaluronic Acid: Hydrates immediately and for up to 24 hours.Aqua (Water), Glycerin, Ethylhexyl Palmitate, C12-15 Alkyl Benzoate, PEG-6 Caprylic/Capric Glycerides, Betaine, Polyglyceryl-3 Dicitrate/Stearate, Sodium Acrylate/Sodium Acryloyldimethyl Taurate Copolymer, Isohexadecane, Pentylene Glycol, Propanediol, Butyrospermum Parkii (Shea) Butter, Hydroxyacetophenone, Oryza Sativa (Rice Starch), Caprylyl Glycol, Cetearyl Olivate, Polysorbate 80, Sorbitan Olivate, Ethylhexylglycerin, Sodium Hydroxide, Sorbitan Oleate, Xanthan Gum, Hydrolyzed Rice Protein, Oryza Sativa (Rice) Bran Oil, Inulin, Polyquaternium-10, Hydrolyzed Sodium Hyaluronate, Sodium Hyaluronate, Phenoxyethanol, Lecithin.The list of ingredients is subject to change. Please consult the packaging of the product purchased. -Rice Milk 5%: Softens and supports skin’s barrier.-Hyaluronic Acid: Hydrates immediately and for up to 24 hours.Aqua (Water), Glycerin, Ethylhexyl Palmitate, C12-15 Alkyl Benzoate, PEG-6 Caprylic/Capric Glycerides, Betaine, Polyglyceryl-3 Dicitrate/Stearate, Sodium Acrylate/Sodium Acryloyldimethyl Taurate Copolymer, Isohexadecane, Pentylene Glycol, Propanediol, Butyrospermum Parkii (Shea) Butter, Hydroxyacetophenone, Oryza Sativa (Rice Starch), Caprylyl Glycol, Cetearyl Olivate, Polysorbate 80, Sorbitan Olivate, Ethylhexylglycerin, Sodium Hydroxide, Sorbitan Oleate, Xanthan Gum, Hydrolyzed Rice Protein, Oryza Sativa (Rice) Bran Oil, Inulin, Polyquaternium-10, Hydrolyzed Sodium Hyaluronate, Sodium Hyaluronate, Phenoxyethanol, Lecithin.The list of ingredients is subject to change. Please consult the packaging of the product purchased."
cleanser, https://www.sephora.com/product/beste-no-9-jelly-cleanser-P426836?skuId=2022598&icid2=products%20grid:p426836:product                                                                                      , Drunk Elephant            , Beste™ No. 9 Jelly Cleanser                                                                     , "-Mild Surfactant Blend: A stack of mild cleansing agents, including coconut-based surfactants rich in fatty acids that work together to create a gentle lather that effectively dissolves even stubborn makeup, sunscreen, and oils while supporting a healthy-looking skin barrier.-Glycerin: A skin-identical humectant that replenishes hydration levels normally lost during the cleansing process.-Cantaloupe Fruit Extract: Rich in antioxidants, this extract soothes and hydrates.Water, Glycerin, Cocamidopropyl Betaine, Coco-Glucoside, Sodium Lauroyl Methyl Isethionate, Cocamidopropyl Hydroxysultaine, Sodium Methyl Oleoyl Taurate, Propanediol, Aloe Barbadensis Leaf Extract, Glycolipids, Linoleic Acid, Linolenic Acid, Lauryl Glucoside, Cucumis Melo Cantalupensis Fruit Extract, Sclerocarya Birrea Seed Oil, Dipotassium Glycyrrhizate, Tocopherol, Citric Acid, Phenoxyethanol, Sodium Hydroxide, Sodium Benzoate, Sodium Chloride, Polylysine.The list of ingredients is subject to change, please consult the packaging of the product purchased. -Mild Surfactant Blend: A stack of mild cleansing agents, including coconut-based surfactants rich in fatty acids that work together to create a gentle lather that effectively dissolves even stubborn makeup, sunscreen, and oils while supporting a healthy-looking skin barrier.-Glycerin: A skin-identical humectant that replenishes hydration levels normally lost during the cleansing process.-Cantaloupe Fruit Extract: Rich in antioxidants, this extract soothes and hydrates.Water, Glycerin, Cocamidopropyl Betaine, Coco-Glucoside, Sodium Lauroyl Methyl Isethionate, Cocamidopropyl Hydroxysultaine, Sodium Methyl Oleoyl Taurate, Propanediol, Aloe Barbadensis Leaf Extract, Glycolipids, Linoleic Acid, Linolenic Acid, Lauryl Glucoside, Cucumis Melo Cantalupensis Fruit Extract, Sclerocarya Birrea Seed Oil, Dipotassium Glycyrrhizate, Tocopherol, Citric Acid, Phenoxyethanol, Sodium Hydroxide, Sodium Benzoate, Sodium Chloride, Polylysine.The list of ingredients is subject to change, please consult the packaging of the product purchased."
